Name,Address,Phone
AV Retail Pvt. Ltd.,"Basement, 337, Sector 38, Sector 38, Gurugram - 122001, Dist.Gurugram, Haryana",08046068554
All The Small Things,"Basement , Ground & 1st Floor, Booth No -30, Huda, Sector 31, Gurugram - 122001, Dist.Gurugram, Haryana",08044921555
JPY Mobile Phone Accessories,"4/25,block-4, First Floor, W.e.a .saraswati Marg, Karol Bagh, Karol Bagh, New Delhi - 110005, Dist.New Delhi, Delhi",08047638233
Shri Sai Telecom,"Ground Floor, 8349, Tibbiya College, Karol Bagh, Karol Bagh, New Delhi - 110005, Dist.New Delhi, Delhi",07942565603
Sai Telecom,"Basement, G-10, Mobile Hub, H.S. Road, Karol Bagh, Karol Bagh, New Delhi - 110005, Dist.New Delhi, Delhi",08048962511
Mahi International,"I-16/540, Karol Bagh, Military Road, Karol Bagh, New Delhi - 110005, Dist.New Delhi, Delhi",07949224116
S.K. Enterprises,"3rd Floor, Property No. 15-A/58, W.E.A. Karol Bagh, Karol Bagh, New Delhi - 110005, Dist.New Delhi, Delhi",07942816395
Trade Fiesta,"2nd Floor, Wz-474, Gali No. 1 Sri Nagar, Raja Park, Shakur Basti, Shakurpur, New Delhi - 110034, Dist.New Delhi, Delhi",07942837450
Sri Maa Jwalaji Trading Co.,"Second Floor, 1192-A, Chand Mohalla, Gandhi Nagar, Gali No. 2, Karol Bagh, New Delhi - 110031, Dist.New Delhi, Delhi",07942709262
Uddo Inc.,"Shop No.16 Plot No. 33,Block No. 13, Karol Bagh, Karol Bagh, New Delhi - 110005, Dist.New Delhi, Delhi",08046030571
Cenoda Technology Private Limited,"Portion Of Lower Ground Floor, A-6, Budh Vihar, Mathura Road, Badarpur, Badarpur, New Delhi - 110044, Dist.New Delhi, Delhi",08047313421
Suman Enterprises,"3rd Floor, 308, Ocean Building, 12 Nehru Place, Nehru Place, Nehru Place, New Delhi - 110019, Dist.New Delhi, Delhi",08048958941
Narang Laptop Solution,"Ground Floor, Shop No.2 10b,10c, Kushal Bazar 32-33, Nehru Place, Nehru Place, New Delhi - 110019, Dist.New Delhi, Delhi",08046059978
Yoroto International,"Block-A, House No.1, Mahendra Park, Near Adarsh Nagar, Adarsh Nagar, New Delhi - 110033, Dist.New Delhi, Delhi",08048967421
Victory Devices Private Limited,"1663, Bhagirath Palace Chandni Chawk, Chandni Chowk, New Delhi - 110006, Dist.New Delhi, Delhi",08046057287
P V Electronics,"2884, Basement Pvt. No-B-2,Gall, No-17 H.S.Road,Bedanpura, Karol, Bagh, Delhi, Karol bagh, New Delhi - 110005, Dist.New Delhi, Delhi",08043857872
Vision Enterprises,"Ground Floor, House No 756, Block B, Landmark NA Weavers Colony Ashok Vihar, Ashok Vihar, New Delhi - 110052, Dist.New Delhi, Delhi",08045909714
Reliable Accessories Private Limited,"3rd Floor 3356, Plot No-30, Block-q Christian Colony, Karol Bagh Chirtsian Colony, PALAM, SOUTH WEST DELHI, New Delhi - 110005, Dist.New Delhi, Delhi",08044011037
P3a Consumer Products Private Limited,"533/2, Jain Mandir Gali, Gandhi Nagar, New Delhi - 110031, Dist.New Delhi, Delhi",07942622390
Tisha Impex,"13/36 Basement Shop Num 15 shop num 15, Karol Bagh, New Delhi - 110005, Dist.New Delhi, Delhi",08047635498
